<?xml version="1.0" encoding="UTF-8"?>
<!--Sample XML file generated by XMLSpy v2010 (http://www.altova.com)-->
<xvmconfig configVersion="1.0.0" xsi:noNamespaceSchemaLocation="XVM.xsd" xmlns:xsi="http://www.w3.org/2001/XMLSchema-instance">
	<definition>
		<author>String</author>
		<description>String</description>
		<url>String</url>
		<date>2001-12-17T09:30:47Z</date>
		<gameVersion>String</gameVersion>
		<modVersion>String</modVersion>
	</definition>
	<battle>
		<showPostmortemTips>true</showPostmortemTips>
		<disableMirroredVehicleIcons>false</disableMirroredVehicleIcons>
	</battle>
	<behaviors>
		<ally>
			<alive>
				<normal>
					<vehicleIcon alpha="0" color="String" x="0" visible="true" y="0" maxScale="0" scaleX="0" scaleY="0">
						<shadow alpha="0" color="String" angle="0" strength="0" distance="0" size="0"/>
					</vehicleIcon>
					<playerName alpha="0" color="String" text="String" x="0" visible="true" y="0">
						<shadow alpha="0" color="String" angle="0" strength="0" distance="0" size="0"/>
						<font align="left" size="0" name="String"/>
					</playerName>
					<vehicleName alpha="0" color="String" text="String" x="0" visible="true" y="0">
						<shadow alpha="0" color="String" angle="0" strength="0" distance="0" size="0"/>
						<font align="left" size="0" name="String"/>
					</vehicleName>
					<healthBar alpha="0" color="String" x="0" visible="true" height="0" y="0" width="0" lcolor="String">
						<border alpha="0" color="String" size="0"/>
						<fill alpha="0" color="String"/>
						<damage alpha="0" color="String" fade="0"/>
					</healthBar>
					<currentHealth alpha="0" color="String" text="String" visible="true" x="0" y="0" showMaxValue="true">
						<shadow alpha="0" color="String" angle="0" strength="0" distance="0" size="0"/>
						<font align="left" size="0" name="String"/>
					</currentHealth>
					<healthRatio alpha="0" color="String" text="String" x="0" visible="true" y="0">
						<shadow alpha="0" color="String" angle="0" strength="0" distance="0" size="0"/>
						<font align="left" size="0" name="String"/>
					</healthRatio>
					<combatScrollText alpha="0" color="String" text="String" visible="true" x="0" y="0">
						<shadow alpha="0" color="String" angle="0" strength="0" distance="0" size="0"/>
						<font align="left" size="0" name="String"/>
						<speed>0</speed>
						<maxRange>0</maxRange>
						<damageMessage>String</damageMessage>
						<blowupMessage>String</blowupMessage>
					</combatScrollText>
					<contourIcon alpha="0" color="String" x="0" visible="true" y="0" amount="0">
						<shadow alpha="0" color="String" angle="0" strength="0" distance="0" size="0"/>
					</contourIcon>
					<levelIcon alpha="0" visible="true" x="0" y="0"/>
					<actionMarker alpha="0" visible="true" x="0" y="0"/>
				</normal>
				<extended>
					<vehicleIcon alpha="0" color="String" x="0" visible="true" y="0" maxScale="0" scaleX="0" scaleY="0">
						<shadow alpha="0" color="String" angle="0" strength="0" distance="0" size="0"/>
					</vehicleIcon>
					<playerName alpha="0" color="String" text="String" x="0" visible="true" y="0">
						<shadow alpha="0" color="String" angle="0" strength="0" distance="0" size="0"/>
						<font align="left" size="0" name="String"/>
					</playerName>
					<vehicleName alpha="0" color="String" text="String" x="0" visible="true" y="0">
						<shadow alpha="0" color="String" angle="0" strength="0" distance="0" size="0"/>
						<font align="left" size="0" name="String"/>
					</vehicleName>
					<healthBar alpha="0" color="String" x="0" visible="true" height="0" y="0" width="0" lcolor="String">
						<border alpha="0" color="String" size="0"/>
						<fill alpha="0" color="String"/>
						<damage alpha="0" color="String" fade="0"/>
					</healthBar>
					<currentHealth alpha="0" color="String" text="String" visible="true" x="0" y="0" showMaxValue="true">
						<shadow alpha="0" color="String" angle="0" strength="0" distance="0" size="0"/>
						<font align="left" size="0" name="String"/>
					</currentHealth>
					<healthRatio alpha="0" color="String" text="String" x="0" visible="true" y="0">
						<shadow alpha="0" color="String" angle="0" strength="0" distance="0" size="0"/>
						<font align="left" size="0" name="String"/>
					</healthRatio>
					<combatScrollText alpha="0" color="String" text="String" visible="true" x="0" y="0">
						<shadow alpha="0" color="String" angle="0" strength="0" distance="0" size="0"/>
						<font align="left" size="0" name="String"/>
						<speed>0</speed>
						<maxRange>0</maxRange>
						<damageMessage>String</damageMessage>
						<blowupMessage>String</blowupMessage>
					</combatScrollText>
					<contourIcon alpha="0" color="String" x="0" visible="true" y="0" amount="0">
						<shadow alpha="0" color="String" angle="0" strength="0" distance="0" size="0"/>
					</contourIcon>
					<levelIcon alpha="0" visible="true" x="0" y="0"/>
					<actionMarker alpha="0" visible="true" x="0" y="0"/>
				</extended>
			</alive>
			<dead>
				<normal>
					<vehicleIcon alpha="0" color="String" x="0" visible="true" y="0" maxScale="0" scaleX="0" scaleY="0">
						<shadow alpha="0" color="String" angle="0" strength="0" distance="0" size="0"/>
					</vehicleIcon>
					<playerName alpha="0" color="String" text="String" x="0" visible="true" y="0">
						<shadow alpha="0" color="String" angle="0" strength="0" distance="0" size="0"/>
						<font align="left" size="0" name="String"/>
					</playerName>
					<vehicleName alpha="0" color="String" text="String" x="0" visible="true" y="0">
						<shadow alpha="0" color="String" angle="0" strength="0" distance="0" size="0"/>
						<font align="left" size="0" name="String"/>
					</vehicleName>
					<healthBar alpha="0" color="String" x="0" visible="true" height="0" y="0" width="0" lcolor="String">
						<border alpha="0" color="String" size="0"/>
						<fill alpha="0" color="String"/>
						<damage alpha="0" color="String" fade="0"/>
					</healthBar>
					<currentHealth alpha="0" color="String" text="String" visible="true" x="0" y="0" showMaxValue="true">
						<shadow alpha="0" color="String" angle="0" strength="0" distance="0" size="0"/>
						<font align="left" size="0" name="String"/>
					</currentHealth>
					<healthRatio alpha="0" color="String" text="String" x="0" visible="true" y="0">
						<shadow alpha="0" color="String" angle="0" strength="0" distance="0" size="0"/>
						<font align="left" size="0" name="String"/>
					</healthRatio>
					<combatScrollText alpha="0" color="String" text="String" visible="true" x="0" y="0">
						<shadow alpha="0" color="String" angle="0" strength="0" distance="0" size="0"/>
						<font align="left" size="0" name="String"/>
						<speed>0</speed>
						<maxRange>0</maxRange>
						<damageMessage>String</damageMessage>
						<blowupMessage>String</blowupMessage>
					</combatScrollText>
					<contourIcon alpha="0" color="String" x="0" visible="true" y="0" amount="0">
						<shadow alpha="0" color="String" angle="0" strength="0" distance="0" size="0"/>
					</contourIcon>
					<levelIcon alpha="0" visible="true" x="0" y="0"/>
					<actionMarker alpha="0" visible="true" x="0" y="0"/>
				</normal>
				<extended>
					<vehicleIcon alpha="0" color="String" x="0" visible="true" y="0" maxScale="0" scaleX="0" scaleY="0">
						<shadow alpha="0" color="String" angle="0" strength="0" distance="0" size="0"/>
					</vehicleIcon>
					<playerName alpha="0" color="String" text="String" x="0" visible="true" y="0">
						<shadow alpha="0" color="String" angle="0" strength="0" distance="0" size="0"/>
						<font align="left" size="0" name="String"/>
					</playerName>
					<vehicleName alpha="0" color="String" text="String" x="0" visible="true" y="0">
						<shadow alpha="0" color="String" angle="0" strength="0" distance="0" size="0"/>
						<font align="left" size="0" name="String"/>
					</vehicleName>
					<healthBar alpha="0" color="String" x="0" visible="true" height="0" y="0" width="0" lcolor="String">
						<border alpha="0" color="String" size="0"/>
						<fill alpha="0" color="String"/>
						<damage alpha="0" color="String" fade="0"/>
					</healthBar>
					<currentHealth alpha="0" color="String" text="String" visible="true" x="0" y="0" showMaxValue="true">
						<shadow alpha="0" color="String" angle="0" strength="0" distance="0" size="0"/>
						<font align="left" size="0" name="String"/>
					</currentHealth>
					<healthRatio alpha="0" color="String" text="String" x="0" visible="true" y="0">
						<shadow alpha="0" color="String" angle="0" strength="0" distance="0" size="0"/>
						<font align="left" size="0" name="String"/>
					</healthRatio>
					<combatScrollText alpha="0" color="String" text="String" visible="true" x="0" y="0">
						<shadow alpha="0" color="String" angle="0" strength="0" distance="0" size="0"/>
						<font align="left" size="0" name="String"/>
						<speed>0</speed>
						<maxRange>0</maxRange>
						<damageMessage>String</damageMessage>
						<blowupMessage>String</blowupMessage>
					</combatScrollText>
					<contourIcon alpha="0" color="String" x="0" visible="true" y="0" amount="0">
						<shadow alpha="0" color="String" angle="0" strength="0" distance="0" size="0"/>
					</contourIcon>
					<levelIcon alpha="0" visible="true" x="0" y="0"/>
					<actionMarker alpha="0" visible="true" x="0" y="0"/>
				</extended>
			</dead>
		</ally>
		<squad>
			<alive>
				<normal>
					<vehicleIcon alpha="0" color="String" x="0" visible="true" y="0" maxScale="0" scaleX="0" scaleY="0">
						<shadow alpha="0" color="String" angle="0" strength="0" distance="0" size="0"/>
					</vehicleIcon>
					<playerName alpha="0" color="String" text="String" x="0" visible="true" y="0">
						<shadow alpha="0" color="String" angle="0" strength="0" distance="0" size="0"/>